Index,Text 1,Text 2,Relationship (HUMAN),Relationship (LLAMA)
74,A baby boy 's head floats up from water .,"He goes back under , looking around in amazement .",NA,Yes,"The second event implies that the baby boy has already surfaced from the water, so the two events must be consecutive."
75,We see the blue opening screen .,The man then puts on his gloves and dances a bit in the yard .,NA,No,"There is no apparent connection between the blue opening screen and a man putting on gloves and dancing in a yard, suggesting they are unrelated events."
76,The woman continues kicking up her legs and ends by jumping down .,An athletic woman is seen balancing herself on two beams .,NA,Yes,"The woman's kicking up her legs and jumping down suggests that she is in the process of warming up or practicing gymnastics, which could be followed by balancing herself on two beams, a common gymnastics exercise."
77,"The man then picks up an iron and begins to melt some of the wax onto it by rubbing it on the hot iron , then onto the material on the ski and then back and forth to melting the wax and rubbing it onto the long piece of fabric on the ski .","The man then picks up a small container and words on the screen appear saying that it 's "" vauhti violet glider "" and when he removes the content it looks like a purple bar of wax .",NA,Yes,"The events are likely to be part of the same process. In the first event, the man is melting wax onto the ski, and in the second event, he is obtaining the wax (Vauhti Violet Glider) that he will then use to melt onto the ski."
78,"Two men are in a weight room , one is sitting in a chair , and the other is standing on a mat about to jerk the bar .",The same male then lifts the bar four times and is successful at each attempt .,NA,Yes,"Event 2 is a direct continuation of Event 1, as the man is already standing on the mat and about to jerk the bar, and then proceeds to lift the bar multiple times."
79,We shift to see him play and he talks to the camera .,The camera zooms out on the man playing the accordion .,NA,Yes,"The event of shifting to see him play likely precedes the event of him talking to the camera, as one would typically see the action before hearing the commentary."
80,We see him playing the accordion again .,We fade in from black as the man talks .,NA,Yes,"The phrase 'We fade in from black' typically indicates the beginning of a scene or sequence, and the phrase 'We see him playing the accordion again' suggests that this is a continuation of something that has already started. Therefore, it is likely that Event 2 precedes Event 1."
81,The trainer walks the camel in a circle in a wide circle in the parking lot area with the children riding .,The trainer guides the children on a camel in front of the stage holding presenters and a large crowd .,NA,Yes,It is likely that the trainer walks the camel in a circle in the parking lot area with the children riding before guiding the children on a camel in front of the stage holding presenters and a large crowd.
82,The view then returns to the boys skateboarding together again as they pass homes on each sides of the road and they continue to pass the stick to one another to take turns taking the video .,A 5th boy suddenly appears and takes the stick to take his turn in filming .,NA,Yes,"The second event occurs after the first event, as the boys continue to pass the stick to one another before a 5th boy appears to take his turn in filming."
83,The girl uses a comb with a pick to part her hair .,The girl adds hair product to her hair and combs it through with her hands .,NA,Yes,It is likely that the girl uses the comb with a pick (Event 1) after applying hair product to her hair (Event 2) and combing it through with her hands.
84,We see a bathroom sink and counter .,The man then washes the container .,NA,Yes,"The event of washing the container likely occurs after the event of seeing the bathroom sink and counter, as the container would need to be placed on the sink or counter before it can be washed."
85,A camera pans around a large group of people are seen kite surfing along the water while some sit on the sides to watch .,More clips are shown of people riding around along the water with some falling in and others standing back up .,NA,Yes,"The events appear to be showing the same activity (kite surfing) and likely occur in a sequence, with Event 1 showing the initial activity and Event 2 showing the continuation or progression of the activity."
86,The two children move backwards as the teens leave .,The credits of video are shown .,NA,No,"The events seem to be unrelated and cannot be temporally related. The first event appears to be about children moving backwards, while the second event is about showing credits of a video."
87,The young girl stops and begins to try and takes the food off the fork and they both begin laughing .,The little girl then sits down and they both begin to look on the floor for a piece of food that fell off of the fork .,NA,Yes,"The second event is a direct continuation of the first event, as the food has fallen off the fork and they are now looking for it together."
88,The men begin to play the guitars .,Two men are sitting on stools with guitars in their laps with captions .,NA,Yes,"It seems that the men are preparing to play the guitars, as they are sitting on stools with guitars in their laps with captions, which suggests that they are about to start playing."
89,"  The canoe and the hand travel down a rocky water way and pass other people , trees and rocks .","A hand is seen paddling in the water along with the front of the canoe the person paddling is in , the body and face are not visible , however .",NA,Yes,The second event describes a moment in time that is part of the sequence described in the first event. The hand paddling in the water is likely the same hand described in the first event as traveling down the rocky waterway.
90,The camera man adjusts the camera and covers it with his hand .,We see two men playing squash in an indoor court .,NA,Yes,"The camera man adjusts the camera and covers it with his hand likely before recording the squash match, so the events are likely to occur in this order."
91,"A black screen appears and a blue area with black text reads "" 20 Seconds "" and it flashes multiple times .","Various items are shown that include a toilet paper roll , a bottle of handwash and running water from a faucet .",NA,Yes,"The flashing '20 Seconds' likely indicates a countdown, suggesting that the items being shown in Event 2 will appear after the 20 seconds have passed."
92,"They lay down on mats , using exercise balls to do sit ups , then doing arm lifts .","They raise them to their chests , then over their heads very quickly , doing several sets .",NA,Yes,"The second event appears to be a continuation of the first event. The first event describes exercising with exercise balls, and the second event describes doing arm lifts, which is a natural progression from the sit-ups and arm lifts described in the first event."
93,The man is again being interviewed with several shots of balls being thrown and more people being interviewed .,Various shots of people are shown as well a bowling balls being thrown down a lane .,NA,Yes,"The shots of bowling balls being thrown and the people being interviewed suggest that the man is being interviewed about bowling, and the shots of balls being thrown and people being interviewed are likely part of the same interview or activity."
94,  The man does a routine on the horse .,  People in the arena applaud the man .,NA,Yes,"The routine on the horse is likely to be performed before the applause, as the applause is a reaction to the performance."
95,Two people are seen kicking around a skateboard and lead into clips of them riding down a road .,The men continue moving around the city through obstacles and moving along the road .,NA,Yes,"The first event describes the men learning to ride the skateboard, and the second event describes them using the skills they learned to ride down the road and navigate the city, implying a temporal sequence."
96,We see the title screen on black .,The lady with the hose is seen again .,NA,No,"The information provided does not give enough context to determine if one event precedes the other. The title screen could appear at the beginning of a movie, game, or program, and the lady with the hose could appear anywhere in the sequence."
97,"When he returns the fourth time , he hits another strike by knocking down all the pins .",There 's a person in a red shirt and black shoes bowling in a bowling alley .,NA,Yes,"The person in the red shirt and black shoes must have been bowling and knocking down pins before hitting another strike, as the event describes returning for the fourth time."
98,The medal is cooled down and the finished weld can be seen .,A portable power sources has electric tools plugged into it .,NA,No,There is no apparent causal or temporal relationship between the two events. The cooling down of a medal and the use of electric tools seem unrelated and could have occurred at any point in time.
99,They stack the mango slices on a plate .,They put the fruit into a juicer and pour the juice into a large jug .,NA,No,There is no apparent reason why the events must occur in a particular order. The mango slices could be stacked before or after they are put into a juicer.
100,He grabs a mop and dips it into the bucket and rings out excess water .,A man grabs a swiffer and cleans a small area of the floor in his living room .,NA,No,"The events describe different cleaning tasks and tools, and there is no clear temporal relationship between them."
101,"After , the woman takes off her clothes and makes sexy movements .",The woman walks in the yard and pretend to shoot .,NA,Yes,"The phrase 'After' indicates that Event 1 occurs subsequent to Event 2, suggesting a temporal relationship between the two events."
102,A black screen with white letters scrolling from the bottom to the top includes the names of all the boys in the video .,The boys then begin to ride their skateboards on the road and now there 's a 4th boy who has also joined them as they continue riding down the road and filming themselves while taking turns holding the stick with the camera attached to it .,NA,Yes,"The scrolling names on the black screen likely occur before the boys start riding their skateboards, as it appears to be a title sequence or credits for the video."
103,A man is seen speaking to the camera using his hands in the end .,The people push themselves along in the canoe and show more people riding along .,NA,No,"The two events describe unrelated activities and there is no indication of a temporal relationship between them, such as one event leading to or following the other."
104,The man continues to play the instrument up and down moving his hands all around .,A person is seen close up holding a guitar and begins playing the instrument while moving his arms around .,NA,Yes,"The description of the person playing the instrument up and down and moving their hands all around suggests that they are already playing the instrument, which is consistent with the description of the person in event 2 starting to play the instrument."
105,"When he returns the fourth time , he hits another strike by knocking down all the pins .",There 's a person in a red shirt and black shoes bowling in a bowling alley .,NA,No,"Event 2 provides a general setting, but does not provide any information about the person's actions or progress in bowling, making it unclear when or if the events in Event 1 might occur."
106,"For the first one , he has the ball on the end of the tennis racket that is upside down , he jilts the tennis racket up and hits the ball while it is up in the air .",He is alone and starts to illustrate different tricks that you could do when servicing the ball .,NA,Yes,"The second event describes the process of illustrating tricks, which is likely to occur after the first event, where the person starts to hit the ball with the tennis racket, demonstrating the tricks in action."
107,A young woman cleans the engine area of a car .,  A woman cleans the window of a big truck .,NA,No,There is no logical connection or sequence between cleaning an engine area and cleaning a window of a truck. They appear to be unrelated activities.
108,The gate opens and he ropes a small animal and throws it on the ground and ties its back lets .,He stands up and runs to get back on the horse .,NA,Yes,The event of catching and tying the animal's back legs likely occurs before the event of standing up and getting back on the horse.
109,The camera zooms out and a yellow frame appears .,"  Justin is playing the drums with a caption "" Justin Beiber Drum Solo "" .",NA,Yes,"The caption and the drum solo are likely to be part of a video or a broadcast, and the yellow frame appearing is likely a transition or an introduction to the drum solo, suggesting that Event 1 precedes Event 2."
110,The men start after the card and ride their dirt bikes .,The end titles appear on a black screen .,NA,Yes,"The end titles typically appear after the main content of a movie or TV show has finished, which in this case would include the scene where men ride their dirt bikes."
111,The men continue to huddle and play a game of rock paper scissors while cheering afterwards .,A large group of people are seen standing on a field with players carrying others on their backs .,NA,No,The two events describe different activities (rock paper scissors game and a ritual/game of carrying people on backs) and do not appear to be related in time.
112,"Mothers grab their babies to come up for air , and a baby breathes as he looks at the camera .",A baby boy 's head floats up from water .,NA,Yes,"The event of grabbing the baby to come up for air suggests that the baby was underwater, and the baby's head floating up from water is a natural consequence of being grabbed, so it is likely that Event 1 precedes Event 2."
113,A large beer pong table is shown with cups laid out and people playing .,Many clips are shown of people playing beer pong as well as speaking to the camera .,NA,Yes,"The second event is likely a continuation of the first event, as the description of the second event is showing more of the same activity that was already happening in the first event."
114,The   man fills he bucket and dumps it out .,We see a man and a boy playing in the sand .,NA,Yes,"It is likely that the man fills the bucket and dumps it out before the boy plays in the sand, as the sand would need to be prepared before play."
115,Text speaks of an event that is coming up .,They are shown jumping   off cliffs into the water before rafting again .,NA,Yes,"The event mentioned in Event 1 is likely the preparation or setup for the rafting activity described in Event 2, which implies a temporal relationship where Event 1 precedes Event 2."
116,  Man sleeps in a bed .,Man talks to someone on the camera .,NA,No,There is no apparent causal or sequential relationship between sleeping in a bed and talking on a camera. These events seem unrelated and can occur at any point in time.
117,One of the students does impressive stunts and moves while snowboarding .,The instructors are helping and teaching the young students to begin snowboarding and teaching them various steps .,NA,Yes,"It is likely that the instructors in Event 2 teach the students the basics of snowboarding, and then the students, including the one who does impressive stunts and moves, progress to more advanced skills, including the stunts and moves mentioned in Event 1."
118,One of the students does impressive stunts and moves while snowboarding .,The instructors are helping and teaching the young students to begin snowboarding and teaching them various steps .,NA,Yes,"It is likely that the students, who are being taught various steps, will eventually progress to doing impressive stunts and moves, as is the typical progression in learning a new skill."
119,The boys then begin to ride their skateboards on the road and now there 's a 4th boy who has also joined them as they continue riding down the road and filming themselves while taking turns holding the stick with the camera attached to it .,"Two young boys wearing helmets , holding skateboards and carrying backpacks are walking through an area that is heavily filled with leaves and trees .",NA,Yes,"Event 2 describes the boys walking to a location, and Event 1 describes them arriving at that location and starting to ride their skateboards. The description in Event 2 suggests that the boys are walking to a place where they will engage in an activity, which is then described in Event 1."
120,There 's a young man wearing a blue shirt and black hat demonstrating on a bed and talking about fitness .,He is talking about fitness as he lays on his back to demonstrate crunches by doing actions with his arms .,NA,Yes,"The second event describes a continuation of the first event, as the young man is still talking about fitness and demonstrating exercises, specifically crunches."
121,The individual squeezes the lemons ' juice into a mug using a tool .,The individual mixes some water into the mug .,NA,Yes,The individual must first squeeze the lemon's juice into the mug before mixing water into it.
122,A woman sits on front a red shoe .,"Next , the woman puts the shoe on the table and continues talking .",NA,Yes,"The second event describes the woman's action after she sits on the front of the red shoe, indicating a temporal relationship between the two events."
123,"There are two men connected to the large rock wall , one is higher up on the rock and the other one is on the ground and when the man that is higher repels very quickly , the man on the ground quickly gets lifted from the ground but not all the way up the rock wall .","A man is tied to the top of a rock wall and he quickly repels and the words "" clean big falls ! "" appear on the screen .",NA,Yes,"Event 1 describes the process of repelling down the rock wall, and Event 2 appears to be a continuation of that process, showing the man at the top of the wall quickly repelling and possibly reaching the ground, which matches the description in Event 1."
124,"A lady in short hair , wearing an orange top is standing by the kitchen counter , on the counter there are black pan , mayo , foil , plate , bread , knife .","She placed the bread on the plate , cut it and half , she is sitting on the green chair and started eating her sandwich .",NA,Yes,"The events are likely to be part of a sequence, with Event 1 describing the setup for making a sandwich and Event 2 describing the actual act of making and eating the sandwich."
125,We see the man talking and hug his dog .,We see a landscape in the desert .,NA,No,"The two events appear to be unrelated and do not have a clear temporal connection, as there is no apparent link between a man hugging his dog and a landscape in the desert."
126,A group of people get off of a yellow school bus with life rafts around their neck and enter a foliage filled area leading to a body of water .,  The man continues to talk to the camera intersperses with images of the people having fun at the water event .,NA,Yes,"The people getting off the bus and entering the foliage filled area likely precedes the 'water event' described in Event 2, which is likely the activity they are engaging in with the man talking to the camera."
127,"Another man is also standing outdoors and he also swings the axe and chops a piece of wood and the wood piece gets stuck onto his axe , he removes the wood from the axe , hits it again and it gets stuck once more and he walks out of view from the camera .","A man is standing outdoors wearing an orange tanktop and green shorts , holding an axe and then he swings it over his head and chops a piece of wood .",NA,Yes,"The second event describes the same action as the first event, but in a more general sense. The first event provides more detail, showing the process of chopping the wood and getting it stuck on the axe, which suggests that the second event is a continuation or a snapshot of the same action, implying a temporal relationship."
128,There 's a small boy snowboarding down the slope .,The young snowboarder continues to go down the mountain slope steadily .,NA,Yes,"The first event sets the scene for the second event, implying that the snowboarding activity has already begun and is continuing in the second event."
129,She slowly places the lens into her eyes .,A young woman is pulling back both of her eyelids open with her finger .,NA,Yes,It seems that the second event (pulling back eyelids) is a necessary step to perform the first event (placing the lens into her eyes).
130,A guy squats on ice next to a plant .,The guy brings a fish from the ice which is attached to the string .,NA,Yes,"It is likely that the guy squats on ice next to a plant before he brings a fish from the ice, as the act of bringing a fish implies that the fish was present on the ice and the guy had to retrieve it."
131,A close up shot of one of the women begins as she 's talking and the banner indicates she 's a shuffleboard player by the name of FRIEDA GALLAWAY .,The women are now the focus and they are playing at a shuffleboard taking turns hitting the disc .,NA,Yes,"The first event describes Frieda Gallaway as talking, implying that the conversation or interview has just started, and the second event shows the women playing shuffleboard, which is likely the activity they are discussing or preparing to engage in, making it likely that the second event occurs after the first."
132,"The winner smiles , flexes his two arms , stands up , shows his arm muscles and he sits down on another table .","A black screen appears and the white words on it read "" ARM WRESTLING MATCH",NA,Yes,"The arm wrestling match is likely to start after the introduction on the screen, and the winner's actions in Event 1 are likely to happen after the match has taken place."
133,He resumes mopping the living room .,The mop is wet and he uses it to clean the living room .,NA,Yes,"The event 'The mop is wet' likely precedes 'He resumes mopping the living room', as the mop needs to be wet before it can be used to mop."
134,A man is water skiing very fast .,An old black and white video is shown before cutting to several clips of boats being controlled and driven through the water .,NA,Yes,"The video shown before cutting to several clips of boats being controlled and driven through the water likely includes footage of water skiing, which is what the man is doing in Event 1."
135,"A counter top with lemons and ingredients in small bowls is shown , with several individuals standing by the counter .",The individual rearranges the items on the counter top .,NA,Yes,"The individuals standing by the counter must have been there before the counter was rearranged, so the event 2 (rearranging the items) must have happened after event 1 (showing the counter with lemons and ingredients)."
136,A baby boy 's head floats up from water .,"Mothers grab their babies to come up for air , and a baby breathes as he looks at the camera .",NA,Yes,"The baby's head floating up from water suggests that the baby was underwater, and the mothers grabbing their babies to come up for air implies that the babies were submerged in water. Therefore, it is likely that Event 1 precedes Event 2, as the baby's head floating up from water is a necessary condition for the mothers to grab their babies to come up for air."
137,They pass by other people on kayaks as they sail along .,Then they get off the kayaks and stand on the river banks to look over the river .,NA,Yes,"The second event cannot occur before the first event, as they must pass by other people on kayaks before they get off the kayaks."
138,"Another man is also standing outdoors and he also swings the axe and chops a piece of wood and the wood piece gets stuck onto his axe , he removes the wood from the axe , hits it again and it gets stuck once more and he walks out of view from the camera .",The camera man then walks over to the cut pieces of wood and the outro screen comes on with scrolling words of the name of the men who were chopping the wood .,NA,Yes,"The camera man walking over to the cut pieces of wood and showing the outro screen with scrolling words likely happens after the man chopping the wood walks out of view, as it is a common practice to show the finished product or credits after the main event has concluded."
139,A woman in a purple shirt is standing in a yard .,The dogs are playing with a frisbee .,NA,No,"There is no apparent connection between the woman in a purple shirt standing in a yard and the dogs playing with a frisbee, so it's unclear which event might occur first or if they are related at all."
140,"After , other dancers perform break dance .",Young boys dance break dance spinning and flipping on the floor .,NA,Yes,"The phrase 'After' explicitly indicates that Event 1 precedes Event 2, implying a temporal relationship."
141,"Two men are in a weight room , one is sitting in a chair , and the other is standing on a mat about to jerk the bar .","After him , a shirtless man tries to lift it but he ca n't get it off the ground either .",NA,Yes,"The second event mentions 'After him', indicating that the second man is attempting to lift the bar after the first man, who was also trying to lift it."
142,A man is kneeling on the ground shining a shoe .,A man in white walks down the sidewalk .,NA,Yes,"It is likely that the man in white walked down the sidewalk after the man had finished shining his shoe, as shining a shoe is typically a task that is performed before leaving the house or a specific location."
